{
  "schema_version": 1,
  "name": "Academic Light",
  "mode": "light",
  "description": "A clear academic workspace with teal actions and violet focus.",
  "colors": {
    "canvas": "#EFF3F9",
    "surface": "#FFFFFF",
    "surface_alt": "#F3F6FC",
    "header": "#183153",
    "header_hover": "#24476E",
    "on_header": "#FFFFFF",
    "on_header_muted": "#D3E5FA",
    "text": "#1D2D44",
    "muted": "#52647D",
    "heading": "#183153",
    "border": "#7688A1",
    "divider": "#D6DFEB",
    "primary": "#087F83",
    "primary_hover": "#066B70",
    "primary_pressed": "#055A61",
    "on_primary": "#FFFFFF",
    "primary_soft": "#E2F4F2",
    "on_primary_soft": "#183153",
    "accent": "#6545AD",
    "on_accent": "#FFFFFF",
    "accent_soft": "#EFE9FA",
    "focus": "#6545AD",
    "disabled": "#E1E7F0",
    "disabled_text": "#56667D",
    "success": "#246448",
    "success_soft": "#E3F3EA",
    "warning": "#88551A",
    "warning_soft": "#FFF0D5",
    "danger": "#A12D46",
    "danger_soft": "#FCE8EC"
  }
}
