{
  "schema_version": 1,
  "name": "Midnight Dark",
  "mode": "dark",
  "description": "A dark reading environment with readable semantic states.",
  "colors": {
    "canvas": "#131922",
    "surface": "#1B2430",
    "surface_alt": "#222E3D",
    "header": "#101A29",
    "header_hover": "#22374D",
    "on_header": "#F4F7FC",
    "on_header_muted": "#C4D6E8",
    "text": "#F0F4FA",
    "muted": "#BECADC",
    "heading": "#DAE7FA",
    "border": "#8294AE",
    "divider": "#39485D",
    "primary": "#63C7C3",
    "primary_hover": "#7ADAD5",
    "primary_pressed": "#9DE9E3",
    "on_primary": "#10282D",
    "primary_soft": "#203D40",
    "on_primary_soft": "#C2F1E9",
    "accent": "#B49AE6",
    "on_accent": "#201B32",
    "accent_soft": "#353049",
    "focus": "#9579C8",
    "disabled": "#303B4B",
    "disabled_text": "#C1CBD9",
    "success": "#8DD5AC",
    "success_soft": "#233D32",
    "warning": "#EDC17E",
    "warning_soft": "#413524",
    "danger": "#F2A3B3",
    "danger_soft": "#472B34"
  }
}
